Id,Code,Name,Standard Class,Domain,Vocab,Validity,Concept
8715,32485007,Hospital admission,Procedure,Observation,SNOMED,Valid,Standard
506639,1.05276E+15,Referral from health visitor,Procedure,Observation,SNOMED,Valid,Standard
506640,1.05277E+15,Discharge by health visitor,Procedure,Observation,SNOMED,Valid,Standard
506641,1.05278E+15,Referral to health visitor,Procedure,Observation,SNOMED,Valid,Standard
506642,1.05279E+15,First annual visit by health visitor,Procedure,Observation,SNOMED,Valid,Standard
506644,1.05283E+15,Health visitor initial visit,Procedure,Observation,SNOMED,Valid,Standard
506646,1.05286E+15,Accident and emergency attendance follow-up visit by health visitor,Procedure,Observation,SNOMED,Valid,Standard
506648,1.05288E+15,Health visitor child 4 month contact,Procedure,Observation,SNOMED,Valid,Standard
506703,1.05365E+15,Child in Need meeting,Procedure,Observation,SNOMED,Valid,Standard
506751,1.05433E+15,Provision of information about infant safe sleeping,Procedure,Observation,SNOMED,Valid,Standard
506760,1.05446E+15,Discharge from leg ulcer service,Procedure,Observation,SNOMED,Valid,Standard
507324,1.06058E+15,Referral for Early Help Assessment,Procedure,Observation,SNOMED,Valid,Standard
507342,1.06077E+15,Referral to Identification and Referral to Improve Safety advocate educator,Procedure,Observation,SNOMED,Valid,Standard
507648,1.05424E+15,Referral to hospital diabetes antenatal clinic,Procedure,Observation,SNOMED,Valid,Standard
507692,1.05423E+15,Referral to community diabetes antenatal clinic,Procedure,Observation,SNOMED,Valid,Standard
703452,1.23978E+15,Major incident survivor annual review,Procedure,Observation,SNOMED,Valid,Standard
703453,1.23977E+15,Major incident survivor monitoring,Procedure,Observation,SNOMED,Valid,Standard
761971,2.51E+11,Dialysis care plan,Procedure,Observation,SNOMED,Valid,Standard
762179,3.01E+11,Hemodialysis care plan,Procedure,Observation,SNOMED,Valid,Standard
762463,4.031E+12,Notification of epilepsy to Department of Motor Vehicles,Procedure,Observation,SNOMED,Valid,Standard
762473,4.141E+12,Encounter for blood donation,Procedure,Observation,SNOMED,Valid,Standard
762508,4.28231E+14,Maternal postpartum depression care,Procedure,Observation,SNOMED,Valid,Standard
762516,4.28361E+14,Discharge to home for hospice care,Procedure,Observation,SNOMED,Valid,Standard
762522,4.28431E+14,Chronic wound care,Procedure,Observation,SNOMED,Valid,Standard
762523,4.28441E+14,Referral to nurse anesthetist,Procedure,Observation,SNOMED,Valid,Standard
762524,4.28451E+14,Referral to physician assistant,Procedure,Observation,SNOMED,Valid,Standard
762525,4.28461E+14,Referral to nutrition professional,Procedure,Observation,SNOMED,Valid,Standard
762526,4.28481E+14,Referral to clinical social worker,Procedure,Observation,SNOMED,Valid,Standard
762527,4.28491E+14,Referral to anesthesiologist assistant,Procedure,Observation,SNOMED,Valid,Standard
762529,4.28541E+14,Referral to nurse midwife,Procedure,Observation,SNOMED,Valid,Standard
762560,4.28921E+14,Consultation for transition of care,Procedure,Observation,SNOMED,Valid,Standard
762561,4.28931E+14,Pharmacogenetic consultation,Procedure,Observation,SNOMED,Valid,Standard
762573,4.29101E+14,Documentation of medication therapy management plan,Procedure,Observation,SNOMED,Valid,Standard
762574,4.29111E+14,Documentation of care summary,Procedure,Observation,SNOMED,Valid,Standard
762602,4.29471E+14,Lensometry measurement,Procedure,Observation,SNOMED,Valid,Standard
762603,4.29481E+14,Keratometry measurement,Procedure,Observation,SNOMED,Valid,Standard
762608,4.29551E+14,Referral for balance AND/OR gait assessment,Procedure,Observation,SNOMED,Valid,Standard
762710,4.30881E+14,Referral for safety counseling associated with dementia,Procedure,Observation,SNOMED,Valid,Standard
762711,4.30901E+14,Acute dialysis program,Procedure,Observation,SNOMED,Valid,Standard
762712,4.30911E+14,Navy dialysis program,Procedure,Observation,SNOMED,Valid,Standard
762713,4.30921E+14,Army dialysis program,Procedure,Observation,SNOMED,Valid,Standard
762714,4.30941E+14,Prison dialysis program,Procedure,Observation,SNOMED,Valid,Standard
762715,4.30951E+14,Veteran's administration dialysis program,Procedure,Observation,SNOMED,Valid,Standard
762765,4.31551E+14,Documentation of personal medication record,Procedure,Observation,SNOMED,Valid,Standard
762766,4.31561E+14,Monitoring of laboratory results,Procedure,Observation,SNOMED,Valid,Standard
762818,4.32351E+14,Documentation of medication related action plan,Procedure,Observation,SNOMED,Valid,Standard
762824,4.32421E+14,Discharge to healthcare facility,Procedure,Observation,SNOMED,Valid,Standard
762836,4.32601E+14,Durable medical equipment supplier dialysis program,Procedure,Observation,SNOMED,Valid,Standard
762837,4.32611E+14,Centers for Medicare and Medicaid Services approved special purpose dialysis program,Procedure,Observation,SNOMED,Valid,Standard
762839,4.32661E+14,"Hospital admission, transfer from emergency department",Procedure,Observation,SNOMED,Valid,Standard
762859,4.32921E+14,Documentation of mental health medication action plan,Procedure,Observation,SNOMED,Valid,Standard
762860,4.32931E+14,Documentation of depression medication action plan,Procedure,Observation,SNOMED,Valid,Standard
762861,4.32941E+14,Documentation of pulmonary disorder medication action plan,Procedure,Observation,SNOMED,Valid,Standard
762862,4.32951E+14,Documentation of chronic obstructive pulmonary disorder medication action plan,Procedure,Observation,SNOMED,Valid,Standard
762863,4.32971E+14,Documentation of cardiovascular disorder medication action plan,Procedure,Observation,SNOMED,Valid,Standard
762864,4.32981E+14,Documentation of hypertension medication action plan,Procedure,Observation,SNOMED,Valid,Standard
762865,4.32991E+14,Documentation of heart failure medication action plan,Procedure,Observation,SNOMED,Valid,Standard
762866,4.33001E+14,Documentation of coronary heart disease medication action plan,Procedure,Observation,SNOMED,Valid,Standard
762867,4.33011E+14,Documentation of metabolic disorder medication action plan,Procedure,Observation,SNOMED,Valid,Standard
762868,4.33021E+14,Documentation of gout medication action plan,Procedure,Observation,SNOMED,Valid,Standard
762869,4.33031E+14,Documentation of dyslipidemia medication action plan,Procedure,Observation,SNOMED,Valid,Standard
762870,4.33041E+14,Documentation of endocrine disorder medication action plan,Procedure,Observation,SNOMED,Valid,Standard
762871,4.33051E+14,Documentation of diabetes medication action plan,Procedure,Observation,SNOMED,Valid,Standard
762872,4.33061E+14,Documentation of infectious disease medication action plan,Procedure,Observation,SNOMED,Valid,Standard
762873,4.33071E+14,Documentation of human immunodeficiency virus infection medication action plan,Procedure,Observation,SNOMED,Valid,Standard
762874,4.33081E+14,Documentation of gastrointestinal disorder medication action plan,Procedure,Observation,SNOMED,Valid,Standard
762875,4.33091E+14,Documentation of neurologic disorder medication action plan,Procedure,Observation,SNOMED,Valid,Standard
762876,4.33101E+14,Documentation of immunologic disorder medication action plan,Procedure,Observation,SNOMED,Valid,Standard
762877,4.33111E+14,Documentation of hematologic disorder medication action plan,Procedure,Observation,SNOMED,Valid,Standard
762878,4.33121E+14,Documentation of anticoagulation medication action plan,Procedure,Observation,SNOMED,Valid,Standard
762879,4.33131E+14,Documentation of pain medication action plan,Procedure,Observation,SNOMED,Valid,Standard
762880,4.33141E+14,Documentation of rheumatic disease medication action plan,Procedure,Observation,SNOMED,Valid,Standard
762881,4.33151E+14,Documentation of renal disorder medication action plan,Procedure,Observation,SNOMED,Valid,Standard
762882,4.33161E+14,Documentation of smoking cessation medication action plan,Procedure,Observation,SNOMED,Valid,Standard
762883,4.33181E+14,Documentation of palliative care medication action plan,Procedure,Observation,SNOMED,Valid,Standard
762884,4.33201E+14,Documentation of pregnancy and lactation medication action plan,Procedure,Observation,SNOMED,Valid,Standard
762885,4.33211E+14,Documentation of transplant medication action plan,Procedure,Observation,SNOMED,Valid,Standard
762906,4.33591E+14,Discharge to rehabilitation facility,Procedure,Observation,SNOMED,Valid,Standard
762987,4.34641E+14,Death certification and verification by physician,Procedure,Observation,SNOMED,Valid,Standard
762988,4.34651E+14,Death certification by physician,Procedure,Observation,SNOMED,Valid,Standard
763000,4.34781E+14,Discharge to acute care hospital,Procedure,Observation,SNOMED,Valid,Standard
763005,4.34841E+14,Referral for home safety evaluation,Procedure,Observation,SNOMED,Valid,Standard
763082,4.35871E+14,Documentation of past medical history,Procedure,Observation,SNOMED,Valid,Standard
763376,4.39421E+14,"Local AIDS pharmaceutical assistance, APA, not ADAP",Procedure,Observation,SNOMED,Valid,Standard
763518,4.42021E+14,Referral to adult day care program,Procedure,Observation,SNOMED,Valid,Standard
763536,4.42271E+14,Patient transfer to psychiatric hospital,Procedure,Observation,SNOMED,Valid,Standard
763537,4.42291E+14,Discharge from observation unit,Procedure,Observation,SNOMED,Valid,Standard
763691,4.44831E+14,Referral for physical therapy,Procedure,Observation,SNOMED,Valid,Standard
763697,4.44911E+14,Referral for office-based physical therapy,Procedure,Observation,SNOMED,Valid,Standard
763701,4.44971E+14,Annual wellness visit,Procedure,Observation,SNOMED,Valid,Standard
763811,4.46661E+14,Death pronouncement,Procedure,Observation,SNOMED,Valid,Standard
763889,4.48231E+14,Electronic notification of encounter in electronic medical record,Procedure,Observation,SNOMED,Valid,Standard
763902,4.48381E+14,Urgent hospital admission,Procedure,Observation,SNOMED,Valid,Standard
763905,4.48421E+14,"Hospital admission, transfer from physician office",Procedure,Observation,SNOMED,Valid,Standard
763906,4.48441E+14,"Hospital admission, transfer from intermediate care facility",Procedure,Observation,SNOMED,Valid,Standard
763917,4.48551E+14,Patient transfer to another hospital,Procedure,Observation,SNOMED,Valid,Standard
763918,4.48561E+14,Patient transfer to non-psychiatric hospital,Procedure,Observation,SNOMED,Valid,Standard
763919,4.48571E+14,Patient transfer to substance abuse treatment facility,Procedure,Observation,SNOMED,Valid,Standard
763927,4.48671E+14,Voluntary patient transfer to psychiatric hospital,Procedure,Observation,SNOMED,Valid,Standard
763928,4.48681E+14,Involuntary patient transfer to psychiatric hospital,Procedure,Observation,SNOMED,Valid,Standard
763929,4.48691E+14,Patient transfer to inpatient behavioral healthcare facility,Procedure,Observation,SNOMED,Valid,Standard
763934,4.48741E+14,Referral to interventional radiology service,Procedure,Observation,SNOMED,Valid,Standard
763935,4.48751E+14,Referral to interventional vascular radiology service,Procedure,Observation,SNOMED,Valid,Standard
763936,4.48761E+14,Referral to endovascular specialist,Procedure,Observation,SNOMED,Valid,Standard
763943,4.48851E+14,Hospital admission from observation unit,Procedure,Observation,SNOMED,Valid,Standard
763951,4.48971E+14,"Transfer to psychiatric hospital, willingness undocumented",Procedure,Observation,SNOMED,Valid,Standard
763973,4.49221E+14,Referral to different healthcare provider,Procedure,Observation,SNOMED,Valid,Standard
763987,4.49381E+14,Discharge from skilled nursing facility,Procedure,Observation,SNOMED,Valid,Standard
763988,4.49391E+14,Discharge from nursing home,Procedure,Observation,SNOMED,Valid,Standard
763989,4.49401E+14,Discharge from inpatient rehabilitation facility,Procedure,Observation,SNOMED,Valid,Standard
763990,4.49411E+14,Admission to skilled nursing facility,Procedure,Observation,SNOMED,Valid,Standard
763991,4.49421E+14,Admission to nursing home,Procedure,Observation,SNOMED,Valid,Standard
763992,4.49431E+14,Admission to inpatient rehabilitation facility,Procedure,Observation,SNOMED,Valid,Standard
763994,4.49451E+14,Electronic notification of encounter via patient portal,Procedure,Observation,SNOMED,Valid,Standard
764027,4.49841E+14,Referral to tobacco use cessation clinic,Procedure,Observation,SNOMED,Valid,Standard
764028,4.49851E+14,Referral to tobacco use cessation counselor,Procedure,Observation,SNOMED,Valid,Standard
764029,4.49861E+14,Referral to tobacco use cessation counseling program,Procedure,Observation,SNOMED,Valid,Standard
764030,4.49871E+14,Referral to tobacco use quit line,Procedure,Observation,SNOMED,Valid,Standard
764060,4.50271E+14,Perioperative administration of steroid,Procedure,Observation,SNOMED,Valid,Standard
764169,4.51571E+14,Gathering of past medical history,Procedure,Observation,SNOMED,Valid,Standard
764170,4.51581E+14,Gathering of current medication list,Procedure,Observation,SNOMED,Valid,Standard
764171,4.51601E+14,Enrollment in co-pay assistance program,Procedure,Observation,SNOMED,Valid,Standard
764172,4.51611E+14,Enrollment in medication assistance program,Procedure,Observation,SNOMED,Valid,Standard
764176,4.51661E+14,Benefits investigation,Procedure,Observation,SNOMED,Valid,Standard
764177,4.51681E+14,Gathering of adverse drug event history,Procedure,Observation,SNOMED,Valid,Standard
764192,4.51851E+14,Health supervision of foundling,Procedure,Observation,SNOMED,Valid,Standard
764193,4.51861E+14,Health supervision of healthy infant,Procedure,Observation,SNOMED,Valid,Standard
764194,4.51871E+14,Health supervision of healthy child,Procedure,Observation,SNOMED,Valid,Standard
764210,4.52061E+14,Surveillance for cancer,Procedure,Observation,SNOMED,Valid,Standard
764211,4.52081E+14,Health evaluation of new immigrant,Procedure,Observation,SNOMED,Valid,Standard
764233,4.52331E+14,Review of imaging finding,Procedure,Observation,SNOMED,Valid,Standard
764295,4.53131E+14,Videotelephony encounter,Procedure,Observation,SNOMED,Valid,Standard
764329,4.53561E+14,Referral for case management,Procedure,Observation,SNOMED,Valid,Standard
764330,4.53581E+14,Referral for occupational therapy,Procedure,Observation,SNOMED,Valid,Standard
764331,4.53601E+14,Referral for management of asthma,Procedure,Observation,SNOMED,Valid,Standard
764332,4.53621E+14,Referral to primary care provider,Procedure,Observation,SNOMED,Valid,Standard
764333,4.53631E+14,Referral to specialist physician,Procedure,Observation,SNOMED,Valid,Standard
764334,4.53651E+14,Referral for care coordination,Procedure,Observation,SNOMED,Valid,Standard
764335,4.53661E+14,Referral to care coordinator,Procedure,Observation,SNOMED,Valid,Standard
764336,4.53691E+14,Referral to certified diabetes educator,Procedure,Observation,SNOMED,Valid,Standard
764337,4.53701E+14,In-person encounter,Procedure,Observation,SNOMED,Valid,Standard
764353,4.53901E+14,Documentation of medication-related goals,Procedure,Observation,SNOMED,Valid,Standard
764354,4.53911E+14,Documentation of medication care plan,Procedure,Observation,SNOMED,Valid,Standard
764355,4.53921E+14,Documentation of allergy history,Procedure,Observation,SNOMED,Valid,Standard
764383,4.54261E+14,Enrollment in smoking cessation program,Procedure,Observation,SNOMED,Valid,Standard
764402,4.54491E+14,Surveillance for colon polyp,Procedure,Observation,SNOMED,Valid,Standard
764417,4.54661E+14,Behavior monitoring,Procedure,Observation,SNOMED,Valid,Standard
764419,4.54681E+14,Referral to pharmaceutical manufacturer medication assistance program,Procedure,Observation,SNOMED,Valid,Standard
764420,4.54691E+14,High-intensity interval training,Procedure,Observation,SNOMED,Valid,Standard
764461,4.55281E+14,Dose-dense methotrexate-vinblastine-doxorubicin-cisplatin chemotherapy regimen,Procedure,Observation,SNOMED,Valid,Standard
764462,4.55291E+14,Dose-adjusted EPOCH,Procedure,Observation,SNOMED,Valid,Standard
764465,4.55381E+14,Death certification by medical examiner or coroner,Procedure,Observation,SNOMED,Valid,Standard
764526,4.56191E+14,Postoperative care for dental procedure,Procedure,Observation,SNOMED,Valid,Standard
764527,4.56201E+14,Medicare Annual Wellness Visit,Procedure,Observation,SNOMED,Valid,Standard
764529,4.56221E+14,Eye movement monitoring,Procedure,Observation,SNOMED,Valid,Standard
764571,4.56751E+14,Electro-analgesia using Scrambler therapy,Procedure,Observation,SNOMED,Valid,Standard
764689,5.371E+12,Referral for imaging study,Procedure,Observation,SNOMED,Valid,Standard
764768,6.051E+12,Pharmacokinetic consultation,Procedure,Observation,SNOMED,Valid,Standard
764769,6.061E+12,Risk evaluation and mitigation strategy consultation,Procedure,Observation,SNOMED,Valid,Standard
764835,6.81E+11,Care plan,Procedure,Observation,SNOMED,Valid,Standard
765400,4.47941E+14,Hospital admission of newborn,Procedure,Observation,SNOMED,Valid,Standard
765441,4.53571E+14,Referral for respiratory therapy,Procedure,Observation,SNOMED,Valid,Standard
765442,4.53611E+14,Referral for high risk medication monitoring,Procedure,Observation,SNOMED,Valid,Standard
765443,4.53671E+14,Referral for management of cholesterol,Procedure,Observation,SNOMED,Valid,Standard
765450,4.55061E+14,Decolonization,Procedure,Observation,SNOMED,Valid,Standard
765467,4.28191E+14,Documentation of current medications,Procedure,Observation,SNOMED,Valid,Standard
765566,3.11E+11,Peritoneal dialysis care plan,Procedure,Observation,SNOMED,Valid,Standard
765598,4.51591E+14,Gathering of allergy history,Procedure,Observation,SNOMED,Valid,Standard
765599,4.51671E+14,Documentation of adverse drug event history,Procedure,Observation,SNOMED,Valid,Standard
765601,4.52071E+14,Surveillance for colorectal cancer,Procedure,Observation,SNOMED,Valid,Standard
765639,4.53591E+14,Referral for management of hypertension,Procedure,Observation,SNOMED,Valid,Standard
765640,4.53641E+14,Referral to specialist pharmacist,Procedure,Observation,SNOMED,Valid,Standard
765641,4.53681E+14,Referral to health plan representative,Procedure,Observation,SNOMED,Valid,Standard
765645,4.53851E+14,Antimicrobial medication monitoring,Procedure,Observation,SNOMED,Valid,Standard
765654,4.28371E+14,Discharge to healthcare facility for hospice care,Procedure,Observation,SNOMED,Valid,Standard
765655,4.28471E+14,Referral to clinical psychologist,Procedure,Observation,SNOMED,Valid,Standard
765776,4.30891E+14,Dialysis regime,Procedure,Observation,SNOMED,Valid,Standard
765777,4.30931E+14,Air force dialysis program,Procedure,Observation,SNOMED,Valid,Standard
765816,4.32311E+14,Documentation of current medication usage,Procedure,Observation,SNOMED,Valid,Standard
765836,4.48431E+14,"Hospital admission, transfer from assisted living facility",Procedure,Observation,SNOMED,Valid,Standard
765844,4.32961E+14,Documentation of asthma medication action plan,Procedure,Observation,SNOMED,Valid,Standard
765845,4.33171E+14,Documentation of geriatric syndrome medication action plan,Procedure,Observation,SNOMED,Valid,Standard
765852,4.48771E+14,Referral to prosthetist,Procedure,Observation,SNOMED,Valid,Standard
765853,4.48861E+14,Dressing change and surveillance of non-surgical wound,Procedure,Observation,SNOMED,Valid,Standard
765855,4.48951E+14,Admission to observation unit,Procedure,Observation,SNOMED,Valid,Standard
765860,4.33191E+14,Documentation of oncologic disorder medication action plan,Procedure,Observation,SNOMED,Valid,Standard
765861,4.33221E+14,Documentation of allergy medication action plan,Procedure,Observation,SNOMED,Valid,Standard
765866,4.42281E+14,Emergency hospital admission from observation unit,Procedure,Observation,SNOMED,Valid,Standard
3171666,2.469E+16,Attempted left rotator cuff tear,Procedure,Observation,Nebraska Lexicon,Valid,Standard
3186286,2.9E+16,Pain contract with physician,Procedure,Observation,Nebraska Lexicon,Valid,Standard
3191531,1.819E+16,Home TPN for fistula healing,Procedure,Observation,Nebraska Lexicon,Valid,Standard
3191540,1.525E+16,Postoperative examination,Procedure,Observation,Nebraska Lexicon,Valid,Standard
3191820,2.747E+16,Aftercare healing pathological arm fracture,Procedure,Observation,Nebraska Lexicon,Valid,Standard
3192485,2.748E+16,Aftercare pathological upper arm fracture,Procedure,Observation,Nebraska Lexicon,Valid,Standard
3192506,2.742E+16,Aftercare for healing lower arm fracture,Procedure,Observation,Nebraska Lexicon,Valid,Standard
3192629,2.746E+16,Aftercare for healing vertebral fracture,Procedure,Observation,Nebraska Lexicon,Valid,Standard
3192869,2.744E+16,Aftercare for healing upper leg fracture,Procedure,Observation,Nebraska Lexicon,Valid,Standard
3193059,2.743E+16,Aftercare healing traumatic leg fracture,Procedure,Observation,Nebraska Lexicon,Valid,Standard
3193417,9.11754E+17,Chimeric antigen receptor CD19 T lymphocyte antineoplastic therapy regimen,Procedure,Observation,Nebraska Lexicon,Valid,Standard
3193501,2.755E+16,Aftercare following joint replacement,Procedure,Observation,Nebraska Lexicon,Valid,Standard
3193954,2.827E+16,Limb restriction of left arm,Procedure,Observation,Nebraska Lexicon,Valid,Standard
3194104,8.36E+15,Therapeutic use of methadone,Procedure,Observation,Nebraska Lexicon,Valid,Standard
3194917,2.74E+16,Aftercare healing fracture of upper arm,Procedure,Observation,Nebraska Lexicon,Valid,Standard
3195162,1.408E+16,Court protection order,Procedure,Observation,Nebraska Lexicon,Valid,Standard
3195167,2.75E+16,Aftercare healing pathological hip fracture,Procedure,Observation,Nebraska Lexicon,Valid,Standard
3196032,2.752E+16,Aftercare pathological upper leg fracture,Procedure,Observation,Nebraska Lexicon,Valid,Standard
3196082,2.753E+16,Aftercare pathological lower leg fracture,Procedure,Observation,Nebraska Lexicon,Valid,Standard
3196176,2.738E+16,Plastic surgery follow up visit,Procedure,Observation,Nebraska Lexicon,Valid,Standard
3196459,1.295E+16,Home nasal BIPAP use,Procedure,Observation,Nebraska Lexicon,Valid,Standard
3196523,2.751E+16,Aftercare healing pathological leg fracture,Procedure,Observation,Nebraska Lexicon,Valid,Standard
3196781,9.36E+15,Aftercare for healing lower leg fracture,Procedure,Observation,Nebraska Lexicon,Valid,Standard
3197037,3.041E+16,Admission for kidney transplant,Procedure,Observation,Nebraska Lexicon,Valid,Standard
3197415,9.11754E+17,Antineoplastic genetically modified or directed therapy regimen,Procedure,Observation,Nebraska Lexicon,Valid,Standard
3197425,2.741E+16,Aftercare healing traumatic hip fracture,Procedure,Observation,Nebraska Lexicon,Valid,Standard
3197430,2.754E+16,Aftercare pathologic vertebral fracture,Procedure,Observation,Nebraska Lexicon,Valid,Standard
3197508,1.94E+16,Occupational therapy encounter,Procedure,Observation,Nebraska Lexicon,Valid,Standard
3197551,1.756E+16,Biphasic positive airway pressure via facial mask,Procedure,Observation,Nebraska Lexicon,Valid,Standard
3198059,2.938E+16,Recurrent laryngeal nerve monitoring,Procedure,Observation,Nebraska Lexicon,Valid,Standard
3198532,2.745E+16,Aftercare for healing lower leg fracture,Procedure,Observation,Nebraska Lexicon,Valid,Standard
3198564,1.685E+16,No IV or blood draw left arm,Procedure,Observation,Nebraska Lexicon,Valid,Standard
3198811,2.749E+16,Aftercare pathological lower arm fracture,Procedure,Observation,Nebraska Lexicon,Valid,Standard
4002163,110461004,Adjunctive care,Procedure,Observation,SNOMED,Valid,Standard
4002165,110465008,Clinical trial,Procedure,Observation,SNOMED,Valid,Standard
4004491,11037005,Perineal care in obstetrics,Procedure,Observation,SNOMED,Valid,Standard
4006706,10161009,"Patient discharge, to home, with assistance",Procedure,Observation,SNOMED,Valid,Standard
4007092,207195004,History and physical examination with evaluation and management of nursing facility patient,Procedure,Observation,SNOMED,Valid,Standard
4010105,112689000,"Hospital admission, elective, with complete pre-admission work-up",Procedure,Observation,SNOMED,Valid,Standard
4010106,112690009,"Hospital admission, boarder, for social reasons",Procedure,Observation,SNOMED,Valid,Standard
4011529,1121002,Kinetic activities for range of motion,Procedure,Observation,SNOMED,Valid,Standard
4012482,11310004,"Breathing exercise, blow bottle",Procedure,Observation,SNOMED,Valid,Standard
4012530,165199000,Social services case conference,Procedure,Observation,SNOMED,Valid,Standard
4012677,165278005,Biopsy specimen not retrieved,Procedure,Observation,SNOMED,Valid,Standard
4012810,165323002,Biopsy administration,Procedure,Observation,SNOMED,Valid,Standard
4013508,112988006,"Recovery room monitoring, anesthesia",Procedure,Observation,SNOMED,Valid,Standard
4013691,165196007,Procedures related to diagnosis,Procedure,Observation,SNOMED,Valid,Standard
4013692,165198008,Writing up - publishing,Procedure,Observation,SNOMED,Valid,Standard
4013778,11414009,Patient transfer to skilled nursing facility for level 4 care,Procedure,Observation,SNOMED,Valid,Standard
4014023,103735009,Palliative care,Procedure,Observation,SNOMED,Valid,Standard
4014027,103764000,"Laboratory reporting, service comment",Procedure,Observation,SNOMED,Valid,Standard
4014030,10378005,"Hospital admission, emergency, from emergency room, accidental injury",Procedure,Observation,SNOMED,Valid,Standard
4014086,113130003,Class in postnatal exercises,Procedure,Observation,SNOMED,Valid,Standard
4014088,113131004,Use of treadmill,Procedure,Observation,SNOMED,Valid,Standard
4014146,169516008,Postcoital intrauterine contraceptive device fitted,Procedure,Observation,SNOMED,Valid,Standard
4014280,169763008,Postnatal - first day visit,Procedure,Observation,SNOMED,Valid,Standard
4014281,169767009,Postnatal - fifth day visit,Procedure,Observation,SNOMED,Valid,Standard
4014282,169768004,Postnatal - sixth day visit,Procedure,Observation,SNOMED,Valid,Standard
4014416,113151000,Special care of eye,Procedure,Observation,SNOMED,Valid,Standard
4014442,169764002,Postnatal - second day visit,Procedure,Observation,SNOMED,Valid,Standard
4014443,169766000,Postnatal - fourth day visit,Procedure,Observation,SNOMED,Valid,Standard
