Id,Code,Name,Standard Class,Domain,Vocab,Validity,Concept
44790591,2.39551E+14,Patient transfer to outpatient department,Procedure,Observation,SNOMED,Valid,Standard
44790592,2.39561E+14,Patient transfer to private home,Procedure,Observation,SNOMED,Valid,Standard
44790593,2.39571E+14,Patient transfer to psychiatric unit,Procedure,Observation,SNOMED,Valid,Standard
44790594,2.39581E+14,Patient transfer to residential home,Procedure,Observation,SNOMED,Valid,Standard
44790604,2.42321E+14,Transportation by fire service,Procedure,Observation,SNOMED,Valid,Standard
44790605,2.42331E+14,Transportation by general practitioner,Procedure,Observation,SNOMED,Valid,Standard
44790606,2.42341E+14,Transportation by Her Majesty's coastguard,Procedure,Observation,SNOMED,Valid,Standard
44790607,2.42351E+14,Transportation by medical team,Procedure,Observation,SNOMED,Valid,Standard
44790608,2.42361E+14,Transportation by mountain rescue,Procedure,Observation,SNOMED,Valid,Standard
44790609,2.42371E+14,Transportation by police,Procedure,Observation,SNOMED,Valid,Standard
44790610,2.42381E+14,Transportation by rapid response unit,Procedure,Observation,SNOMED,Valid,Standard
44790704,2.441E+12,Loan of recorded tape from practice,Procedure,Observation,SNOMED,Valid,Standard
44790735,2.41631E+14,Waveform respired carbon dioxide monitoring,Procedure,Observation,SNOMED,Valid,Standard
44790767,2.44381E+14,Following medical control order,Procedure,Observation,SNOMED,Valid,Standard
44790794,2.42981E+14,British National Formulary guideline,Procedure,Observation,SNOMED,Valid,Standard
44790795,2.42991E+14,Joint Royal College Ambulance Liaison Committee guidelines,Procedure,Observation,SNOMED,Valid,Standard
44790799,2.43021E+14,Inter facility transport,Procedure,Observation,SNOMED,Valid,Standard
44790800,2.43031E+14,Major incident transportation,Procedure,Observation,SNOMED,Valid,Standard
44790801,2.43041E+14,Patient not transported by ambulance,Procedure,Observation,SNOMED,Valid,Standard
44790821,2.431E+12,Loan of items from practice,Procedure,Observation,SNOMED,Valid,Standard
44790822,2.43111E+14,Repatriation by air,Procedure,Observation,SNOMED,Valid,Standard
44790848,2.42171E+14,Admission under the Mental Health Act,Procedure,Observation,SNOMED,Valid,Standard
44790881,2.481E+12,Certification of blindness - England and Wales,Procedure,Observation,SNOMED,Valid,Standard
44790884,2.48121E+14,Referred by probation service worker,Procedure,Observation,SNOMED,Valid,Standard
44790885,2.48131E+14,Referral to dyspepsia specialist nurse,Procedure,Observation,SNOMED,Valid,Standard
44790887,2.48161E+14,Referral for diabetic retinopathy screening,Procedure,Observation,SNOMED,Valid,Standard
44790907,2.48321E+14,Patient held anticoagulation therapy record issued,Procedure,Observation,SNOMED,Valid,Standard
44790908,2.48331E+14,Cancer monitoring telephone invitation,Procedure,Observation,SNOMED,Valid,Standard
44790909,2.48341E+14,Hypothyroidism monitoring telephone invitation,Procedure,Observation,SNOMED,Valid,Standard
44790913,2.501E+12,Scottish partially sighted certification - blindness likely over 16,Procedure,Observation,SNOMED,Valid,Standard
44790916,2.48371E+14,Epilepsy monitoring telephone invitation,Procedure,Observation,SNOMED,Valid,Standard
44790918,2.48411E+14,Atrial fibrillation annual review,Procedure,Observation,SNOMED,Valid,Standard
44790921,2.48461E+14,Coronary heart disease monitoring telephone invitation,Procedure,Observation,SNOMED,Valid,Standard
44790924,2.48491E+14,Follow-up consultation for minor injury,Procedure,Observation,SNOMED,Valid,Standard
44790925,2.48551E+14,Mental health monitoring telephone invitation,Procedure,Observation,SNOMED,Valid,Standard
44790931,2.48621E+14,Referral to special interest general practitioner,Procedure,Observation,SNOMED,Valid,Standard
44790941,2.47171E+14,In-house counselling first appointment,Procedure,Observation,SNOMED,Valid,Standard
44790944,2.48711E+14,Dementia monitoring,Procedure,Observation,SNOMED,Valid,Standard
44790945,2.48721E+14,Chronic kidney disease monitoring,Procedure,Observation,SNOMED,Valid,Standard
44790948,2.47181E+14,In-house counselling discharge,Procedure,Observation,SNOMED,Valid,Standard
44790949,2.47191E+14,In-house counselling follow-up appointment,Procedure,Observation,SNOMED,Valid,Standard
44790950,2.47201E+14,In-house chiropody first appointment,Procedure,Observation,SNOMED,Valid,Standard
44790952,2.47211E+14,In-house chiropody discharge,Procedure,Observation,SNOMED,Valid,Standard
44790953,2.47221E+14,In-house chiropody follow-up appointment,Procedure,Observation,SNOMED,Valid,Standard
44790954,2.47241E+14,In-house ophthalmology discharge,Procedure,Observation,SNOMED,Valid,Standard
44790955,2.47251E+14,In-house ophthalmology follow-up appointment,Procedure,Observation,SNOMED,Valid,Standard
44790956,2.47261E+14,In-house psychiatry,Procedure,Observation,SNOMED,Valid,Standard
44790957,2.47271E+14,In-house ultrasound first appointment,Procedure,Observation,SNOMED,Valid,Standard
44790965,2.47281E+14,In-house ultrasound discharge,Procedure,Observation,SNOMED,Valid,Standard
44790966,2.47291E+14,In-house ultrasound follow-up appointment,Procedure,Observation,SNOMED,Valid,Standard
44790967,2.47301E+14,Safer sex leaflet given,Procedure,Observation,SNOMED,Valid,Standard
44790969,2.47311E+14,In-house dietetics first appointment,Procedure,Observation,SNOMED,Valid,Standard
44790970,2.47321E+14,In-house dietetics discharge appointment,Procedure,Observation,SNOMED,Valid,Standard
44790972,2.47361E+14,Heart failure 6 month review,Procedure,Observation,SNOMED,Valid,Standard
44790976,2.48951E+14,In-house psychiatry first appointment,Procedure,Observation,SNOMED,Valid,Standard
44790977,2.48961E+14,In-house psychiatry discharge,Procedure,Observation,SNOMED,Valid,Standard
44790978,2.48971E+14,In-house psychiatry follow-up appointment,Procedure,Observation,SNOMED,Valid,Standard
44790980,2.48991E+14,Referral to dermatology special interest general practitioner,Procedure,Observation,SNOMED,Valid,Standard
44790988,2.47481E+14,In-house physiotherapy first appointment,Procedure,Observation,SNOMED,Valid,Standard
44790991,2.49011E+14,Referral to gynaecology special interest general practitioner,Procedure,Observation,SNOMED,Valid,Standard
44790993,2.47491E+14,In-house physiotherapy discharge,Procedure,Observation,SNOMED,Valid,Standard
44790994,2.47501E+14,In-house physiotherapy follow-up appointment,Procedure,Observation,SNOMED,Valid,Standard
44790998,2.47541E+14,Referral to falls service,Procedure,Observation,SNOMED,Valid,Standard
44791001,2.49081E+14,Referral to urology special interest general practitioner,Procedure,Observation,SNOMED,Valid,Standard
44791002,2.49091E+14,Referral to ear nose and throat special interest general practitioner,Procedure,Observation,SNOMED,Valid,Standard
44791003,2.491E+12,Scottish - blind certification,Procedure,Observation,SNOMED,Valid,Standard
44791014,2.47611E+14,Congenital heart condition monitoring,Procedure,Observation,SNOMED,Valid,Standard
44791020,2.47671E+14,Refer to Citizens Advice Bureau,Procedure,Observation,SNOMED,Valid,Standard
44791021,2.49171E+14,Chronic kidney disease annual review,Procedure,Observation,SNOMED,Valid,Standard
44791022,2.49181E+14,Dementia annual review,Procedure,Observation,SNOMED,Valid,Standard
44791023,2.49201E+14,Referral to neurology special interest general practitioner,Procedure,Observation,SNOMED,Valid,Standard
44791025,2.4461E+13,Referral to pulmonary rehabilitation,Procedure,Observation,SNOMED,Valid,Standard
44791034,2.47681E+14,Refer to community respiratory team,Procedure,Observation,SNOMED,Valid,Standard
44791036,2.47701E+14,Referral to arthroscopy service,Procedure,Observation,SNOMED,Valid,Standard
44791039,2.47721E+14,Alcohol abuse monitoring,Procedure,Observation,SNOMED,Valid,Standard
44791051,2.47781E+14,Drug abuse monitoring,Procedure,Observation,SNOMED,Valid,Standard
44791072,2.531E+12,England and Wales partially sighted certification,Procedure,Observation,SNOMED,Valid,Standard
44791075,2.5161E+13,Referral to general practitioner for diuretic therapy,Procedure,Observation,SNOMED,Valid,Standard
44791079,2.5171E+13,Referral to general practitioner for angiotensin converting enzyme inhibitor therapy,Procedure,Observation,SNOMED,Valid,Standard
44791093,2.521E+12,Scottish certification visual handicap - stable,Procedure,Observation,SNOMED,Valid,Standard
44791098,2.5221E+13,Referred to cancer primary healthcare multidisciplinary team,Procedure,Observation,SNOMED,Valid,Standard
44791106,2.20931E+14,High cost metabolic drug therapy - OPCS Classification of Interventions and Procedures,Procedure,Observation,SNOMED,Valid,Standard
44791108,2.5241E+13,Discharge from care,Procedure,Observation,SNOMED,Valid,Standard
44791109,2.5551E+13,Referral to mental health crisis team,Procedure,Observation,SNOMED,Valid,Standard
44791112,2.511E+12,Scottish - certification visual handicap,Procedure,Observation,SNOMED,Valid,Standard
44791119,2.5121E+13,Referral to intermediate care,Procedure,Observation,SNOMED,Valid,Standard
44791123,2.5131E+13,Discharge from intermediate care,Procedure,Observation,SNOMED,Valid,Standard
44791186,2.711E+12,Cause of death clarification SD17/18,Procedure,Observation,SNOMED,Valid,Standard
44791209,2.39471E+14,Urgent ambulance call,Procedure,Observation,SNOMED,Valid,Standard
44791217,2.39101E+14,Pre-transplantation of kidney work-up of live donor,Procedure,Observation,SNOMED,Valid,Standard
44791220,2.47231E+14,In-house ophthalmology first appointment,Procedure,Observation,SNOMED,Valid,Standard
44791221,2.78871E+14,Jabadao movement play,Procedure,Observation,SNOMED,Valid,Standard
44791244,2.76011E+14,Referral to clinical assessment service,Procedure,Observation,SNOMED,Valid,Standard
44791252,2.79231E+14,Anticoagulation monitoring in primary care,Procedure,Observation,SNOMED,Valid,Standard
44791259,2.47331E+14,In-house dietetics follow-up appointment,Procedure,Observation,SNOMED,Valid,Standard
44791260,2.79291E+14,Diabetes type 1 review,Procedure,Observation,SNOMED,Valid,Standard
44791263,2.76281E+14,Fast track referral for suspected skin cancer,Procedure,Observation,SNOMED,Valid,Standard
44791270,2.79321E+14,Diabetes type II review,Procedure,Observation,SNOMED,Valid,Standard
44791272,2.76341E+14,Fast track referral for suspected breast cancer,Procedure,Observation,SNOMED,Valid,Standard
44791273,2.76371E+14,Fast track referral for suspected childrens tumour,Procedure,Observation,SNOMED,Valid,Standard
44791274,2.76401E+14,Fast track referral for suspected colorectal cancer,Procedure,Observation,SNOMED,Valid,Standard
44791277,2.49001E+14,Referral to ophthalmology special interest general practitioner,Procedure,Observation,SNOMED,Valid,Standard
44791282,2.76461E+14,Fast track referral for suspected haematology malignancy,Procedure,Observation,SNOMED,Valid,Standard
44791283,2.76491E+14,Fast track referral for suspected lung cancer,Procedure,Observation,SNOMED,Valid,Standard
44791284,2.76521E+14,Fast track referral for suspected sarcoma,Procedure,Observation,SNOMED,Valid,Standard
44791288,2.79521E+14,Referral to community diabetes specialist nurse,Procedure,Observation,SNOMED,Valid,Standard
44791290,2.76551E+14,Fast track referral for suspected upper GI cancer,Procedure,Observation,SNOMED,Valid,Standard
44791291,2.76581E+14,Fast track referral for suspected brain tumour,Procedure,Observation,SNOMED,Valid,Standard
44791300,2.48651E+14,Referral to orthopaedic physiotherapist practitioner,Procedure,Observation,SNOMED,Valid,Standard
44791368,2.48451E+14,Referral to elderly falls prevention clinic,Procedure,Observation,SNOMED,Valid,Standard
44791382,2.78851E+14,"More than words, Hanen programme",Procedure,Observation,SNOMED,Valid,Standard
44791383,2.78861E+14,"Learning language and loving it, Hanen programme",Procedure,Observation,SNOMED,Valid,Standard
44791390,2.80451E+14,Review meeting,Procedure,Observation,SNOMED,Valid,Standard
44791398,2.80461E+14,Child in care statutory review meeting,Procedure,Observation,SNOMED,Valid,Standard
44791400,2.80521E+14,Fast track referral for suspected head and neck cancer,Procedure,Observation,SNOMED,Valid,Standard
44791412,2.82071E+14,Pulmonary surfactant drugs Band 1 - OPCS Classification of Interventions and Procedures,Procedure,Observation,SNOMED,Valid,Standard
44791443,2.4921E+13,Referral to community mental health team,Procedure,Observation,SNOMED,Valid,Standard
44791475,2.85661E+14,Road to recovery cardiac rehabilitation programme,Procedure,Observation,SNOMED,Valid,Standard
44791497,2.79991E+14,SMS text message sent to patient,Procedure,Observation,SNOMED,Valid,Standard
44791509,2.80091E+14,Referred for telecare,Procedure,Observation,SNOMED,Valid,Standard
44791511,2.80121E+14,Referral to home safety service,Procedure,Observation,SNOMED,Valid,Standard
44791532,2.86261E+14,SMS text message received from patient,Procedure,Observation,SNOMED,Valid,Standard
44791544,2.87051E+14,Multidisciplinary meeting,Procedure,Observation,SNOMED,Valid,Standard
44791545,2.87061E+14,Individual programme planning meeting,Procedure,Observation,SNOMED,Valid,Standard
44791549,2.87231E+14,Provision of general practitioner intermediate care,Procedure,Observation,SNOMED,Valid,Standard
44791558,2.87601E+14,Provision of intermediate care,Procedure,Observation,SNOMED,Valid,Standard
44791648,2.93251E+14,Bowel screening polyp surveillance,Procedure,Observation,SNOMED,Valid,Standard
44791705,2.96591E+14,Transportation to GP surgery,Procedure,Observation,SNOMED,Valid,Standard
44791709,2.96641E+14,Transportation to direct admission unit,Procedure,Observation,SNOMED,Valid,Standard
44791710,2.96661E+14,Transportation to medical assessment unit,Procedure,Observation,SNOMED,Valid,Standard
44791711,2.96671E+14,Transportation to minor injury unit,Procedure,Observation,SNOMED,Valid,Standard
44791714,2.98191E+14,Transportation to type 1 accident and emergency unit,Procedure,Observation,SNOMED,Valid,Standard
44791715,2.98201E+14,Transportation to type 2 accident and emergency unit,Procedure,Observation,SNOMED,Valid,Standard
44791717,2.96721E+14,Transportation to National Health Service walk in centre,Procedure,Observation,SNOMED,Valid,Standard
44791724,2.93981E+14,Section 117 aftercare,Procedure,Observation,SNOMED,Valid,Standard
44791726,2.94021E+14,Common mental health conditions stepped care model,Procedure,Observation,SNOMED,Valid,Standard
44791728,2.94081E+14,Step 2 of common mental health conditions stepped care model,Procedure,Observation,SNOMED,Valid,Standard
44791730,2.94111E+14,Step 3 of common mental health conditions stepped care model,Procedure,Observation,SNOMED,Valid,Standard
44791731,2.94141E+14,Step 4 of common mental health conditions stepped care model,Procedure,Observation,SNOMED,Valid,Standard
44791738,2.94171E+14,Step 5 of common mental health conditions stepped care model,Procedure,Observation,SNOMED,Valid,Standard
44791740,2.94231E+14,Provision of telecare community alarm service,Procedure,Observation,SNOMED,Valid,Standard
44791748,3.00151E+14,Surveillance for condition,Procedure,Observation,SNOMED,Valid,Standard
44791749,3.00161E+14,Surveillance for health need,Procedure,Observation,SNOMED,Valid,Standard
44791750,3.00171E+14,Routine health surveillance,Procedure,Observation,SNOMED,Valid,Standard
44791751,3.01781E+14,Shared care,Procedure,Observation,SNOMED,Valid,Standard
44791752,3.01791E+14,Referral to fracture clinic,Procedure,Observation,SNOMED,Valid,Standard
44791754,3.03521E+14,Practical support,Procedure,Observation,SNOMED,Valid,Standard
44791763,3.00391E+14,Spiritual healing,Procedure,Observation,SNOMED,Valid,Standard
44791773,2.98941E+14,Post-operative assessment at 4-6 hours after secondary care discharge,Procedure,Observation,SNOMED,Valid,Standard
44791774,2.98971E+14,Post-operative assessment at 12-24 hours after secondary care discharge,Procedure,Observation,SNOMED,Valid,Standard
44791787,3.03981E+14,At high risk of cardiovascular disease monitoring letter invite,Procedure,Observation,SNOMED,Valid,Standard
44791792,3.00741E+14,Care of urostomy,Procedure,Observation,SNOMED,Valid,Standard
44791793,3.00751E+14,Care of ileostomy,Procedure,Observation,SNOMED,Valid,Standard
44791794,3.00761E+14,Traction care,Procedure,Observation,SNOMED,Valid,Standard
44791799,3.04181E+14,Child taken into care,Procedure,Observation,SNOMED,Valid,Standard
44791800,2.99211E+14,Transportation to accident and emergency unit,Procedure,Observation,SNOMED,Valid,Standard
44791812,3.04271E+14,Clinical support,Procedure,Observation,SNOMED,Valid,Standard
44791819,3.04301E+14,Self referral to substance misuse service,Procedure,Observation,SNOMED,Valid,Standard
44791820,3.04351E+14,Home support,Procedure,Observation,SNOMED,Valid,Standard
44791821,3.04361E+14,Intensive support,Procedure,Observation,SNOMED,Valid,Standard
44791822,3.04371E+14,Maximum level of support,Procedure,Observation,SNOMED,Valid,Standard
44791823,3.04381E+14,Minimum level of support,Procedure,Observation,SNOMED,Valid,Standard
44791841,3.04411E+14,Hygiene care,Procedure,Observation,SNOMED,Valid,Standard
44791843,3.04431E+14,Referral by youth offending team,Procedure,Observation,SNOMED,Valid,Standard
44791844,3.04461E+14,Referral by probation service,Procedure,Observation,SNOMED,Valid,Standard
44791849,3.04491E+14,Referral by syringe exchange service,Procedure,Observation,SNOMED,Valid,Standard
44791850,3.04521E+14,Referral by mental health service,Procedure,Observation,SNOMED,Valid,Standard
44791851,3.04551E+14,Referral by employment service,Procedure,Observation,SNOMED,Valid,Standard
44791852,2.99661E+14,Disposal procedure,Procedure,Observation,SNOMED,Valid,Standard
44791864,2.99671E+14,Safe destruction of drug,Procedure,Observation,SNOMED,Valid,Standard
44791865,2.99681E+14,Disposal of needles,Procedure,Observation,SNOMED,Valid,Standard
44791866,2.99701E+14,Provision of continuing care in nursing home,Procedure,Observation,SNOMED,Valid,Standard
44791882,2.99821E+14,Surveillance of client group,Procedure,Observation,SNOMED,Valid,Standard
44791883,2.99851E+14,Child health surveillance,Procedure,Observation,SNOMED,Valid,Standard
44791884,2.99861E+14,Surveillance for child protection,Procedure,Observation,SNOMED,Valid,Standard
44791885,2.99871E+14,Child developmental surveillance,Procedure,Observation,SNOMED,Valid,Standard
44791893,3.00001E+14,Surveillance of workforce,Procedure,Observation,SNOMED,Valid,Standard
44791896,3.03251E+14,PMP - Pain management programme,Procedure,Observation,SNOMED,Valid,Standard
44791898,3.09901E+14,Self monitoring of INR,Procedure,Observation,SNOMED,Valid,Standard
44791899,3.09931E+14,MRSA decontamination therapy,Procedure,Observation,SNOMED,Valid,Standard
44791910,3.08181E+14,Two way radio encounter,Procedure,Observation,SNOMED,Valid,Standard
44791925,3.05241E+14,Keep well programme,Procedure,Observation,SNOMED,Valid,Standard
44791934,3.06701E+14,Referral to DAFNE diabetes structured education programme,Procedure,Observation,SNOMED,Valid,Standard
44791935,3.06741E+14,Referral to DESMOND diabetes structured education programme,Procedure,Observation,SNOMED,Valid,Standard
44791942,3.06771E+14,Referral to XPERT diabetes structured education programme,Procedure,Observation,SNOMED,Valid,Standard
44791953,3.05611E+14,Referral to cardiac rehabilitation service,Procedure,Observation,SNOMED,Valid,Standard
44791956,3.07051E+14,Referral to headache special interest general practitioner,Procedure,Observation,SNOMED,Valid,Standard
44791969,3.07321E+14,Video-link encounter,Procedure,Observation,SNOMED,Valid,Standard
44791972,3.07451E+14,Discharge by GP with special interest,Procedure,Observation,SNOMED,Valid,Standard
44791984,3.04611E+14,Referral by CARAT service,Procedure,Observation,SNOMED,Valid,Standard
44792004,3.04881E+14,Supporting client choice,Procedure,Observation,SNOMED,Valid,Standard
44792025,3.15311E+14,Urgent referral to primary care service,Procedure,Observation,SNOMED,Valid,Standard
44792026,3.19891E+14,Patient initiated health coach encounter,Procedure,Observation,SNOMED,Valid,Standard
44792027,3.19921E+14,Health coach initiated encounter,Procedure,Observation,SNOMED,Valid,Standard
44792039,3.12251E+14,Common assessment framework for children and young people,Procedure,Observation,SNOMED,Valid,Standard
44792041,3.13891E+14,Emergency voluntary psychiatric admission under Mental Health Act,Procedure,Observation,SNOMED,Valid,Standard
44792051,3.20481E+14,Referral to podiatry assistant,Procedure,Observation,SNOMED,Valid,Standard
44792063,3.20521E+14,Advice about what to bring into hospital,Procedure,Observation,SNOMED,Valid,Standard
44792075,3.20681E+14,Last offices procedure,Procedure,Observation,SNOMED,Valid,Standard
44792117,3.13251E+14,Counterweight weight management programme,Procedure,Observation,SNOMED,Valid,Standard
44792137,3.231E+12,F303 - factory inspection disease notification,Procedure,Observation,SNOMED,Valid,Standard
44792163,3.26811E+14,Referral to dental conservation service,Procedure,Observation,SNOMED,Valid,Standard
44792169,3.23361E+14,Washing deceased patient,Procedure,Observation,SNOMED,Valid,Standard
44792170,3.23371E+14,Dressing deceased patient,Procedure,Observation,SNOMED,Valid,Standard
44792171,3.23391E+14,Dressing deceased patient in own clothes,Procedure,Observation,SNOMED,Valid,Standard
44792184,3.27101E+14,Disposal of sharps,Procedure,Observation,SNOMED,Valid,Standard
44792186,3.27121E+14,Referral to dental service,Procedure,Observation,SNOMED,Valid,Standard
44792187,3.27181E+14,Referral to dental sedation service,Procedure,Observation,SNOMED,Valid,Standard
44792193,3.23991E+14,Safe disposal of contaminated material,Procedure,Observation,SNOMED,Valid,Standard
44792194,3.24001E+14,Safe disposal of radioactively contaminated material,Procedure,Observation,SNOMED,Valid,Standard
44792195,3.24011E+14,Safe disposal of clinical waste,Procedure,Observation,SNOMED,Valid,Standard
44792196,3.24031E+14,Safe disposal of soiled dressing,Procedure,Observation,SNOMED,Valid,Standard
44792201,3.27271E+14,Referral to dental radiology service,Procedure,Observation,SNOMED,Valid,Standard
44792208,3.38611E+14,Control of incubator temperature,Procedure,Observation,SNOMED,Valid,Standard
44792209,3.38621E+14,Decreasing incubator temperature,Procedure,Observation,SNOMED,Valid,Standard
44792210,3.38631E+14,Increasing incubator temperature,Procedure,Observation,SNOMED,Valid,Standard
44792222,3.39091E+14,Private referral for surgical termination of pregnancy,Procedure,Observation,SNOMED,Valid,Standard
44792223,3.39111E+14,Private referral for medical termination of pregnancy,Procedure,Observation,SNOMED,Valid,Standard
44792224,3.39151E+14,Private referral to pregnancy counseling service,Procedure,Observation,SNOMED,Valid,Standard
44792259,3.40441E+14,Disposing of soiled linen,Procedure,Observation,SNOMED,Valid,Standard
44792260,3.40501E+14,Disposing of radioactive body product,Procedure,Observation,SNOMED,Valid,Standard
44792300,3.41861E+14,Hypothyroidism annual review,Procedure,Observation,SNOMED,Valid,Standard
44792302,3.41921E+14,Private referral to hematologist,Procedure,Observation,SNOMED,Valid,Standard
44792306,3.42041E+14,Referral to children's respite care,Procedure,Observation,SNOMED,Valid,Standard
44792307,3.42051E+14,Referral to children's occupational therapy service,Procedure,Observation,SNOMED,Valid,Standard
44792323,3.25021E+14,High dependency nursing care,Procedure,Observation,SNOMED,Valid,Standard
44792324,3.25061E+14,Surveillance of adult population,Procedure,Observation,SNOMED,Valid,Standard
44792325,3.25071E+14,Surveillance of working population,Procedure,Observation,SNOMED,Valid,Standard
44792330,3.25151E+14,Surveillance of immunisation uptake,Procedure,Observation,SNOMED,Valid,Standard
44792348,3.42691E+14,Supervised discharge under section 25a of Mental Health Act 1995,Procedure,Observation,SNOMED,Valid,Standard
44792353,3.42821E+14,Attaching identity bracelet to patient,Procedure,Observation,SNOMED,Valid,Standard
44792364,3.25331E+14,Hospital based outpatient care,Procedure,Observation,SNOMED,Valid,Standard
44792370,3.43121E+14,Choose and book referral,Procedure,Observation,SNOMED,Valid,Standard
44792379,3.43821E+14,Contraceptive check administration,Procedure,Observation,SNOMED,Valid,Standard
44792380,3.43851E+14,Contraceptive check first letter,Procedure,Observation,SNOMED,Valid,Standard
44792381,3.25441E+14,Changing nappy,Procedure,Observation,SNOMED,Valid,Standard
44792393,3.221E+12,Drug addiction notification to CMO,Procedure,Observation,SNOMED,Valid,Standard
44792411,3.26011E+14,Provision of information about easy wear clothing,Procedure,Observation,SNOMED,Valid,Standard
44792412,3.26051E+14,Self care,Procedure,Observation,SNOMED,Valid,Standard
44792424,3.26251E+14,Referral to orthopaedic special interest general practitioner,Procedure,Observation,SNOMED,Valid,Standard
44792432,3.34711E+14,Referral to diabetes special interest general practitioner,Procedure,Observation,SNOMED,Valid,Standard
44792459,3.61731E+14,Alcohol assessment declined - enhanced services administration,Procedure,Observation,SNOMED,Valid,Standard
44792468,3.521E+12,Patient deregistration - medical record envelope sent to health board,Procedure,Observation,SNOMED,Valid,Standard
44792528,3.53831E+14,Patient held anticoagulation therapy record updated - enhanced services administration,Procedure,Observation,SNOMED,Valid,Standard
44792531,3.53961E+14,Referral to community rapid response team,Procedure,Observation,SNOMED,Valid,Standard
44792537,2.79381E+14,Referral to primary care mental health team,Procedure,Observation,SNOMED,Valid,Standard
44792542,3.47421E+14,Community care,Procedure,Observation,SNOMED,Valid,Standard
44792557,3.47621E+14,Changing incontinence pad,Procedure,Observation,SNOMED,Valid,Standard
44792565,3.54721E+14,Urgent referral to psychiatrist,Procedure,Observation,SNOMED,Valid,Standard
44792566,3.54771E+14,Exercise assessment declined - enhanced services administration,Procedure,Observation,SNOMED,Valid,Standard
