Id,Code,Name,Standard Class,Domain,Vocab,Validity,Concept
4127459,304461003,Interrupted direct current to trunk,Procedure,Observation,SNOMED,Valid,Standard
4127460,304462005,Interrupted direct current to lower limb,Procedure,Observation,SNOMED,Valid,Standard
4127573,304466008,Interrupted direct current to hand,Procedure,Observation,SNOMED,Valid,Standard
4127574,304487003,Direct current to knee,Procedure,Observation,SNOMED,Valid,Standard
4127575,306090001,Referral by social worker,Procedure,Observation,SNOMED,Valid,Standard
4127576,306093004,Referral by teacher,Procedure,Observation,SNOMED,Valid,Standard
4127577,306094005,Referral by lip/speech-reading teacher,Procedure,Observation,SNOMED,Valid,Standard
4127578,306095006,Referral by teacher of the deaf,Procedure,Observation,SNOMED,Valid,Standard
4127579,306101007,Referral to establishment,Procedure,Observation,SNOMED,Valid,Standard
4127580,306103005,Referral to department,Procedure,Observation,SNOMED,Valid,Standard
4127581,306106002,Referral to intensive care service,Procedure,Observation,SNOMED,Valid,Standard
4127582,306114008,Referral to respiratory medicine service,Procedure,Observation,SNOMED,Valid,Standard
4127583,306120009,Referral to clinical genetics service,Procedure,Observation,SNOMED,Valid,Standard
4127584,306132008,Referral to special care baby service,Procedure,Observation,SNOMED,Valid,Standard
4127585,306141003,Referral to radiotherapy service,Procedure,Observation,SNOMED,Valid,Standard
4127586,306144006,Referral to magnetic resonance imaging service,Procedure,Observation,SNOMED,Valid,Standard
4127587,306153004,Referral to professional allied to medicine service,Procedure,Observation,SNOMED,Valid,Standard
4127588,306156007,Referral to dance therapy service,Procedure,Observation,SNOMED,Valid,Standard
4127589,306164001,Referral to community-based dietetics service,Procedure,Observation,SNOMED,Valid,Standard
4127590,306168003,Referral to hospital-based occupational therapy service,Procedure,Observation,SNOMED,Valid,Standard
4127591,306169006,Referral to medical physics service,Procedure,Observation,SNOMED,Valid,Standard
4127592,306174003,Referral to community-based speech and language therapy service,Procedure,Observation,SNOMED,Valid,Standard
4127593,306178000,Referral to surgical fitting service,Procedure,Observation,SNOMED,Valid,Standard
4127594,306188004,Referral to pediatric dentistry service,Procedure,Observation,SNOMED,Valid,Standard
4127595,306192006,Referral to general gastrointestinal surgery service,Procedure,Observation,SNOMED,Valid,Standard
4127596,306198005,Referral to plastic surgery service,Procedure,Observation,SNOMED,Valid,Standard
4127597,306199002,Referral to surgical transplant service,Procedure,Observation,SNOMED,Valid,Standard
4127598,306202007,Referral to care of the elderly day hospital,Procedure,Observation,SNOMED,Valid,Standard
4127599,306204008,Referral to psychogeriatric day hospital,Procedure,Observation,SNOMED,Valid,Standard
4127600,306205009,Referral to hospice,Procedure,Observation,SNOMED,Valid,Standard
4127601,306206005,Referral to service,Procedure,Observation,SNOMED,Valid,Standard
4127602,306211007,Referral to audiological screening service,Procedure,Observation,SNOMED,Valid,Standard
4127603,306213005,Referral to distraction test audiological screening,Procedure,Observation,SNOMED,Valid,Standard
4127604,306214004,Referral to aural rehabilitation service,Procedure,Observation,SNOMED,Valid,Standard
4127605,306219009,Referral to adult hearing aid service,Procedure,Observation,SNOMED,Valid,Standard
4127741,306220003,Referral to pediatric hearing aid service,Procedure,Observation,SNOMED,Valid,Standard
4127742,306221004,Referral to speech-reading training service,Procedure,Observation,SNOMED,Valid,Standard
4127743,306232004,Referral for general surgery domiciliary visit,Procedure,Observation,SNOMED,Valid,Standard
4127744,306236001,Referral to open access service,Procedure,Observation,SNOMED,Valid,Standard
4127745,306237005,Referral to palliative care service,Procedure,Observation,SNOMED,Valid,Standard
4127746,306241009,Referral to audiological physician,Procedure,Observation,SNOMED,Valid,Standard
4127747,306244001,Referral to medical technical officer in audiology,Procedure,Observation,SNOMED,Valid,Standard
4127748,306247008,Referral to pediatric audiologist,Procedure,Observation,SNOMED,Valid,Standard
4127749,306249006,Referral to bereavement counselor,Procedure,Observation,SNOMED,Valid,Standard
4127750,306252003,Referral to mental health counselor,Procedure,Observation,SNOMED,Valid,Standard
4127751,306253008,Referral to doctor,Procedure,Observation,SNOMED,Valid,Standard
4127752,306266008,Referral to pathologist,Procedure,Observation,SNOMED,Valid,Standard
4127753,306267004,Referral to blood transfusion doctor,Procedure,Observation,SNOMED,Valid,Standard
4127754,306269001,Referral to general pathologist,Procedure,Observation,SNOMED,Valid,Standard
4127755,306270000,Referral to medical microbiologist,Procedure,Observation,SNOMED,Valid,Standard
4127756,306272008,Referral to clinical allergist,Procedure,Observation,SNOMED,Valid,Standard
4127758,306275005,Referral to respiratory physician,Procedure,Observation,SNOMED,Valid,Standard
4127759,306279004,Referral to clinical geneticist,Procedure,Observation,SNOMED,Valid,Standard
4127761,306292001,Referral to forensic psychiatrist,Procedure,Observation,SNOMED,Valid,Standard
4127762,306294000,Referral to psychiatrist for mental handicap,Procedure,Observation,SNOMED,Valid,Standard
4127763,306295004,Referral to rehabilitation psychiatrist,Procedure,Observation,SNOMED,Valid,Standard
4127764,306305007,Referral to pediatric dentist,Procedure,Observation,SNOMED,Valid,Standard
4127765,306320001,Referral to clinical nurse specialist,Procedure,Observation,SNOMED,Valid,Standard
4127766,306321002,Referral to breast care nurse,Procedure,Observation,SNOMED,Valid,Standard
4127767,306325006,Referral to genitourinary nurse,Procedure,Observation,SNOMED,Valid,Standard
4127768,306326007,Referral to Marie Curie nurse,Procedure,Observation,SNOMED,Valid,Standard
4127769,306333007,Referral to oncology nurse,Procedure,Observation,SNOMED,Valid,Standard
4127770,306334001,Referral to rheumatology nurse specialist,Procedure,Observation,SNOMED,Valid,Standard
4127771,306341007,Referral to community-based midwife,Procedure,Observation,SNOMED,Valid,Standard
4127772,306349009,Referral to music therapist,Procedure,Observation,SNOMED,Valid,Standard
4127773,306358002,Referral to community-based physiotherapist,Procedure,Observation,SNOMED,Valid,Standard
4127774,306362008,Referral to pharmacist,Procedure,Observation,SNOMED,Valid,Standard
4127901,306366006,Referral to social services department social worker,Procedure,Observation,SNOMED,Valid,Standard
4127902,306367002,Referral to social services department care manager,Procedure,Observation,SNOMED,Valid,Standard
4127903,306371004,Referral to teacher of the hearing impaired,Procedure,Observation,SNOMED,Valid,Standard
4127906,306386005,Discharge by genetic counselor,Procedure,Observation,SNOMED,Valid,Standard
4127907,306387001,Discharge by marriage guidance counselor,Procedure,Observation,SNOMED,Valid,Standard
4127908,306392004,Discharge by clinical oncologist,Procedure,Observation,SNOMED,Valid,Standard
4127909,306406007,Discharge by pediatric intensive care specialist,Procedure,Observation,SNOMED,Valid,Standard
4127910,306407003,Discharge by pain management specialist,Procedure,Observation,SNOMED,Valid,Standard
4127911,306408008,Discharge by pathologist,Procedure,Observation,SNOMED,Valid,Standard
4127912,306410005,Discharge by chemical pathologist,Procedure,Observation,SNOMED,Valid,Standard
4127913,306419006,Discharge by chest physician,Procedure,Observation,SNOMED,Valid,Standard
4127914,306420000,Discharge by thoracic physician,Procedure,Observation,SNOMED,Valid,Standard
4127915,306424009,Discharge by clinical neurophysiologist,Procedure,Observation,SNOMED,Valid,Standard
4127916,306429004,Discharge by gastroenterologist,Procedure,Observation,SNOMED,Valid,Standard
4127917,306434000,Discharge by clinical molecular geneticist,Procedure,Observation,SNOMED,Valid,Standard
4127918,306435004,Discharge by genitourinary medicine physician,Procedure,Observation,SNOMED,Valid,Standard
4127919,306437007,Discharge by infectious diseases physician,Procedure,Observation,SNOMED,Valid,Standard
4127920,306438002,Discharge by medical ophthalmologist,Procedure,Observation,SNOMED,Valid,Standard
4127921,306439005,Discharge by nephrologist,Procedure,Observation,SNOMED,Valid,Standard
4127922,306441006,Discharge by nuclear medicine physician,Procedure,Observation,SNOMED,Valid,Standard
4127923,306442004,Discharge by palliative care physician,Procedure,Observation,SNOMED,Valid,Standard
4127924,306445002,Discharge by pediatrician,Procedure,Observation,SNOMED,Valid,Standard
4127925,306446001,Discharge by community pediatrician,Procedure,Observation,SNOMED,Valid,Standard
4127926,306452000,Discharge by obstetrician,Procedure,Observation,SNOMED,Valid,Standard
4127927,306456002,Discharge by liaison psychiatrist,Procedure,Observation,SNOMED,Valid,Standard
4127928,306458001,Discharge by psychiatrist for mental handicap,Procedure,Observation,SNOMED,Valid,Standard
4127929,306459009,Discharge by rehabilitation psychiatrist,Procedure,Observation,SNOMED,Valid,Standard
4127930,306468006,Discharge by orthodontist,Procedure,Observation,SNOMED,Valid,Standard
4127931,306472005,Discharge by endocrine surgeon,Procedure,Observation,SNOMED,Valid,Standard
4127932,306478009,Discharge by hand surgeon,Procedure,Observation,SNOMED,Valid,Standard
4127933,306486009,Discharge by pancreatic surgeon,Procedure,Observation,SNOMED,Valid,Standard
4127934,306489002,Discharge by trauma surgeon,Procedure,Observation,SNOMED,Valid,Standard
4127935,306491005,Discharge by vascular surgeon,Procedure,Observation,SNOMED,Valid,Standard
4128068,306492003,Discharge by nurse,Procedure,Observation,SNOMED,Valid,Standard
4128069,306494002,Discharge by clinical nurse specialist,Procedure,Observation,SNOMED,Valid,Standard
4128070,306496000,Discharge by cardiac rehabilitation nurse,Procedure,Observation,SNOMED,Valid,Standard
4128071,306511006,Discharge by community-based nurse,Procedure,Observation,SNOMED,Valid,Standard
4128072,306513009,Discharge by community psychiatric nurse,Procedure,Observation,SNOMED,Valid,Standard
4128073,306515002,Discharge by district nurse,Procedure,Observation,SNOMED,Valid,Standard
4128075,306518000,Discharge by liaison nurse,Procedure,Observation,SNOMED,Valid,Standard
4128076,306522005,Discharge by midwife,Procedure,Observation,SNOMED,Valid,Standard
4128077,306523000,Discharge by community-based midwife,Procedure,Observation,SNOMED,Valid,Standard
4128078,306531005,Discharge by drama therapist,Procedure,Observation,SNOMED,Valid,Standard
4128079,306532003,Discharge by music therapist,Procedure,Observation,SNOMED,Valid,Standard
4128080,306536000,Discharge by podiatrist,Procedure,Observation,SNOMED,Valid,Standard
4128081,306538004,Discharge by community-based podiatrist,Procedure,Observation,SNOMED,Valid,Standard
4128082,306543006,Discharge by occupational therapist,Procedure,Observation,SNOMED,Valid,Standard
4128089,304563002,Informing relative,Procedure,Observation,SNOMED,Valid,Standard
4128158,290051006,Drinking practice,Procedure,Observation,SNOMED,Valid,Standard
4128363,290045001,Kitchen practice,Procedure,Observation,SNOMED,Valid,Standard
4128364,290046000,Toilet practice,Procedure,Observation,SNOMED,Valid,Standard
4128556,236827009,Radical hemivulvectomy,Procedure,Observation,SNOMED,Valid,Standard
4128580,305262002,Admission by cardiologist,Procedure,Observation,SNOMED,Valid,Standard
4128581,305268003,Admission by clinical neurophysiologist,Procedure,Observation,SNOMED,Valid,Standard
4128582,305271006,Admission by dermatologist,Procedure,Observation,SNOMED,Valid,Standard
4128583,305272004,Admission by endocrinologist,Procedure,Observation,SNOMED,Valid,Standard
4128584,305275002,Admission by general physician,Procedure,Observation,SNOMED,Valid,Standard
4128585,305279008,Admission by nephrologist,Procedure,Observation,SNOMED,Valid,Standard
4128586,305280006,Admission by neurologist,Procedure,Observation,SNOMED,Valid,Standard
4128587,305281005,Admission by nuclear medicine physician,Procedure,Observation,SNOMED,Valid,Standard
4128588,305288004,Admission by liaison psychiatrist,Procedure,Observation,SNOMED,Valid,Standard
4128589,305293001,Admission by surgeon,Procedure,Observation,SNOMED,Valid,Standard
4128590,305303007,Admission by endocrine surgeon,Procedure,Observation,SNOMED,Valid,Standard
4128591,305305000,Admission by general gastrointestinal surgeon,Procedure,Observation,SNOMED,Valid,Standard
4128592,305308003,Admission by general surgeon,Procedure,Observation,SNOMED,Valid,Standard
4128593,305322003,Admission by health care assistant,Procedure,Observation,SNOMED,Valid,Standard
4128594,305326000,Admission by nurse,Procedure,Observation,SNOMED,Valid,Standard
4128595,305330002,Admission by mental health nurse,Procedure,Observation,SNOMED,Valid,Standard
4128596,305335007,Admission to establishment,Procedure,Observation,SNOMED,Valid,Standard
4128597,305340004,Admission to long stay hospital,Procedure,Observation,SNOMED,Valid,Standard
4128598,305354007,Admission to medical department,Procedure,Observation,SNOMED,Valid,Standard
4128599,305368000,Admission to general medical department,Procedure,Observation,SNOMED,Valid,Standard
4128733,305371008,Admission to clinical cytogenetics department,Procedure,Observation,SNOMED,Valid,Standard
4128734,305372001,Admission to clinical molecular genetics department,Procedure,Observation,SNOMED,Valid,Standard
4128735,305376003,Admission to infectious diseases department,Procedure,Observation,SNOMED,Valid,Standard
4128736,305386002,Admission to obstetrics department,Procedure,Observation,SNOMED,Valid,Standard
4128737,305396006,Admission to hematology department,Procedure,Observation,SNOMED,Valid,Standard
4128738,305410002,Admission to cardiothoracic surgery department,Procedure,Observation,SNOMED,Valid,Standard
4128739,305416008,Admission to restorative dentistry department,Procedure,Observation,SNOMED,Valid,Standard
4128740,305419001,Admission to gastrointestinal surgery department,Procedure,Observation,SNOMED,Valid,Standard
4128741,305420007,Admission to general gastrointestinal surgery department,Procedure,Observation,SNOMED,Valid,Standard
4128742,305423009,Admission to general surgical department,Procedure,Observation,SNOMED,Valid,Standard
4128743,305424003,Admission to hepatobiliary surgical department,Procedure,Observation,SNOMED,Valid,Standard
4128744,305427005,Admission to oral surgery department,Procedure,Observation,SNOMED,Valid,Standard
4128745,305432006,Admission to surgical transplant department,Procedure,Observation,SNOMED,Valid,Standard
4129046,12616003,"Patient discharge, escaped from custody",Procedure,Observation,SNOMED,Valid,Standard
4129668,290043008,Self-care practice,Procedure,Observation,SNOMED,Valid,Standard
4129669,290044002,Dressing practice,Procedure,Observation,SNOMED,Valid,Standard
4129670,290048004,Transfer practice,Procedure,Observation,SNOMED,Valid,Standard
4129671,290049007,Feeding practice,Procedure,Observation,SNOMED,Valid,Standard
4130003,23745001,Documentation procedure,Procedure,Observation,SNOMED,Valid,Standard
4131214,410323000,Bonding case management,Procedure,Observation,SNOMED,Valid,Standard
4131219,410356004,Signs/symptoms-mental/emotional case management,Procedure,Observation,SNOMED,Valid,Standard
4131222,410367003,Anatomy/physiology surveillance,Procedure,Observation,SNOMED,Valid,Standard
4131223,410369000,Bladder care surveillance,Procedure,Observation,SNOMED,Valid,Standard
4131224,410375009,Cast care surveillance,Procedure,Observation,SNOMED,Valid,Standard
4131225,410377001,Coping skills surveillance,Procedure,Observation,SNOMED,Valid,Standard
4131226,410381001,Education surveillance,Procedure,Observation,SNOMED,Valid,Standard
4131227,410389004,Gait training surveillance,Procedure,Observation,SNOMED,Valid,Standard
4131228,410400002,Mobility/transfers surveillance,Procedure,Observation,SNOMED,Valid,Standard
4131229,410406008,Positioning surveillance,Procedure,Observation,SNOMED,Valid,Standard
4131230,410413008,Signs/symptoms-physical surveillance,Procedure,Observation,SNOMED,Valid,Standard
4131231,410415001,Specimen collection surveillance,Procedure,Observation,SNOMED,Valid,Standard
4131232,410422009,Support system surveillance,Procedure,Observation,SNOMED,Valid,Standard
4131233,410426007,Discipline surveillance,Procedure,Observation,SNOMED,Valid,Standard
4131392,413125004,Referral to voluntary service,Procedure,Observation,SNOMED,Valid,Standard
4131511,413128002,Discharge from learning disability team,Procedure,Observation,SNOMED,Valid,Standard
4131667,413324005,Patient advised to review package of care,Procedure,Observation,SNOMED,Valid,Standard
4132624,410538000,Scheduling,Procedure,Observation,SNOMED,Valid,Standard
4132625,410539008,Delivery place booking,Procedure,Observation,SNOMED,Valid,Standard
4132745,127778006,Positive expiratory pressure mask physiotherapy,Procedure,Observation,SNOMED,Valid,Standard
4132854,127780000,High frequency chest compression vest physiotherapy,Procedure,Observation,SNOMED,Valid,Standard
4132896,278906000,Nutritional support,Procedure,Observation,SNOMED,Valid,Standard
4133310,127782008,Autogenic pulmonary drainage,Procedure,Observation,SNOMED,Valid,Standard
4133510,412717001,Referral to osteoporosis clinic,Procedure,Observation,SNOMED,Valid,Standard
4133776,413082001,Referral for carotid doppler,Procedure,Observation,SNOMED,Valid,Standard
4133778,413097003,Recommended thickened fluids,Procedure,Observation,SNOMED,Valid,Standard
4134413,397979003,Tetanic stimulation monitoring,Procedure,Observation,SNOMED,Valid,Standard
4134545,398053007,Pressure point protection,Procedure,Observation,SNOMED,Valid,Standard
4134559,398139005,Shiatsu massage,Procedure,Observation,SNOMED,Valid,Standard
4134691,413127007,Referral to learning disability team,Procedure,Observation,SNOMED,Valid,Standard
4134701,413179008,Patient advised to have pregnancy test,Procedure,Observation,SNOMED,Valid,Standard
4134713,398228004,Anesthesia consultation,Procedure,Observation,SNOMED,Valid,Standard
4134719,398253001,Post-tetanic facilitation monitoring,Procedure,Observation,SNOMED,Valid,Standard
4134750,397945004,Unexpected admission to intensive care unit,Procedure,Observation,SNOMED,Valid,Standard
4134854,398003001,Train-of-four monitoring,Procedure,Observation,SNOMED,Valid,Standard
4135168,398752005,Referral to weight maintenance regimen service,Procedure,Observation,SNOMED,Valid,Standard
4135188,398852003,Referral to community retinal screening service,Procedure,Observation,SNOMED,Valid,Standard
4135190,398855001,Referral for eye ultrasound,Procedure,Observation,SNOMED,Valid,Standard
4135348,31751007,Social service referral of home patient,Procedure,Observation,SNOMED,Valid,Standard
4135667,413087007,Referral to respiratory nurse specialist,Procedure,Observation,SNOMED,Valid,Standard
4135675,413130000,Alcohol disorder monitoring,Procedure,Observation,SNOMED,Valid,Standard
4136052,413159000,Referral to musculoskeletal clinic,Procedure,Observation,SNOMED,Valid,Standard
4136053,413163007,Learning disabilities health action plan reviewed,Procedure,Observation,SNOMED,Valid,Standard
4136196,413333007,Patient given verbal advice,Procedure,Observation,SNOMED,Valid,Standard
4136448,412712007,Referral to sexually transmitted infections clinic,Procedure,Observation,SNOMED,Valid,Standard
4136455,412773009,Referral to stroke clinic,Procedure,Observation,SNOMED,Valid,Standard
4136756,413137002,Risk management administration,Procedure,Observation,SNOMED,Valid,Standard
4136774,304566005,Admission for treatment,Procedure,Observation,SNOMED,Valid,Standard
4136776,304578009,Supervision while performing activity of daily living,Procedure,Observation,SNOMED,Valid,Standard
4136777,304579001,Supervision while performing procedure,Procedure,Observation,SNOMED,Valid,Standard
4136883,413162002,Learning disabilities health action plan declined,Procedure,Observation,SNOMED,Valid,Standard
4137047,413293006,Patient to initiate further contact,Procedure,Observation,SNOMED,Valid,Standard
4137061,413334001,Patient given written advice,Procedure,Observation,SNOMED,Valid,Standard
4137116,306553007,Discharge by hospital-based physiotherapist,Procedure,Observation,SNOMED,Valid,Standard
4137242,306559006,Discharge by hospital-based speech and language therapist,Procedure,Observation,SNOMED,Valid,Standard
4137243,306567003,Discharge from family planning service,Procedure,Observation,SNOMED,Valid,Standard
4137244,306569000,Discharge from adult intensive care service,Procedure,Observation,SNOMED,Valid,Standard
4137245,306576005,Discharge from respiratory medicine service,Procedure,Observation,SNOMED,Valid,Standard
4137246,306577001,Discharge from thoracic medicine service,Procedure,Observation,SNOMED,Valid,Standard
4137247,306581001,Discharge from clinical physiology service,Procedure,Observation,SNOMED,Valid,Standard
4137248,306583003,Discharge from endocrinology service,Procedure,Observation,SNOMED,Valid,Standard
4137249,306585005,Discharge from general medical service,Procedure,Observation,SNOMED,Valid,Standard
4137250,306590008,Discharge from clinical molecular genetics service,Procedure,Observation,SNOMED,Valid,Standard
4137251,306596002,Discharge from nuclear medicine service,Procedure,Observation,SNOMED,Valid,Standard
4137252,306605002,Discharge from obstetrics service,Procedure,Observation,SNOMED,Valid,Standard
4137253,306610003,Discharge from liaison psychiatry service,Procedure,Observation,SNOMED,Valid,Standard
4137254,306614007,Discharge from pathology service,Procedure,Observation,SNOMED,Valid,Standard
4137255,306619002,Discharge from occupational health service,Procedure,Observation,SNOMED,Valid,Standard
4137256,306623005,Discharge from podiatry service,Procedure,Observation,SNOMED,Valid,Standard
4137257,306625003,Discharge from hospital podiatry service,Procedure,Observation,SNOMED,Valid,Standard
4137258,306631000,Discharge from community occupational therapy service,Procedure,Observation,SNOMED,Valid,Standard
4137259,306634008,Discharge from community orthoptics service,Procedure,Observation,SNOMED,Valid,Standard
4137260,306638006,Discharge from speech and language therapy service,Procedure,Observation,SNOMED,Valid,Standard
4137261,306649000,Discharge from breast surgery service,Procedure,Observation,SNOMED,Valid,Standard
4137262,306651001,Discharge from thoracic surgery service,Procedure,Observation,SNOMED,Valid,Standard
4137263,306652008,Discharge from cardiac surgery service,Procedure,Observation,SNOMED,Valid,Standard
4137264,306653003,Discharge from dental surgery service,Procedure,Observation,SNOMED,Valid,Standard
4137265,306655005,Discharge from pediatric dentistry service,Procedure,Observation,SNOMED,Valid,Standard
4137266,306662001,Discharge from colorectal surgery service,Procedure,Observation,SNOMED,Valid,Standard
4137267,306663006,Discharge from general surgical service,Procedure,Observation,SNOMED,Valid,Standard
4137268,306666003,Discharge from ophthalmology service,Procedure,Observation,SNOMED,Valid,Standard
4137269,306676000,Discharge from hospice,Procedure,Observation,SNOMED,Valid,Standard
4137270,306677009,Discharge from day hospital,Procedure,Observation,SNOMED,Valid,Standard
4137271,306680005,Discharge from care of the elderly day hospital,Procedure,Observation,SNOMED,Valid,Standard
4137272,306681009,Discharge from hospice day hospital,Procedure,Observation,SNOMED,Valid,Standard
4137273,306682002,Discharge from ward,Procedure,Observation,SNOMED,Valid,Standard
4137274,306685000,Discharge to establishment,Procedure,Observation,SNOMED,Valid,Standard
4137357,425543005,Digital respired carbon dioxide monitoring,Procedure,Observation,SNOMED,Valid,Standard
4137376,425604002,Case management follow up,Procedure,Observation,SNOMED,Valid,Standard
4137393,306697004,Discharge to sheltered housing,Procedure,Observation,SNOMED,Valid,Standard
4137394,306705005,Discharge to police custody,Procedure,Observation,SNOMED,Valid,Standard
4137398,306722007,Referral by agency nurse,Procedure,Observation,SNOMED,Valid,Standard
4137399,306723002,Referral by liaison nurse,Procedure,Observation,SNOMED,Valid,Standard
4137402,306729003,Case closure by social worker,Procedure,Observation,SNOMED,Valid,Standard
4137403,306734004,Referral by general dental surgeon,Procedure,Observation,SNOMED,Valid,Standard
4137413,306765008,Respiratory drainage techniques,Procedure,Observation,SNOMED,Valid,Standard
4137432,32276005,Monitoring of cardiac output by Fick method,Procedure,Observation,SNOMED,Valid,Standard
4137557,306862004,Discharge from dance therapy service,Procedure,Observation,SNOMED,Valid,Standard
4137582,306934005,Referral to vascular surgery service,Procedure,Observation,SNOMED,Valid,Standard
4137718,306981006,Education relating to information and organizations,Procedure,Observation,SNOMED,Valid,Standard
4137737,305224000,Admission by health worker,Procedure,Observation,SNOMED,Valid,Standard
4137738,305230000,Admission by GP,Procedure,Observation,SNOMED,Valid,Standard
4137739,305231001,Admission by own GP,Procedure,Observation,SNOMED,Valid,Standard
4137740,305240002,Admission by intensive care specialist,Procedure,Observation,SNOMED,Valid,Standard
4137741,305242005,Admission by pediatric intensive care specialist,Procedure,Observation,SNOMED,Valid,Standard
4137742,305244006,Admission by community pediatrician,Procedure,Observation,SNOMED,Valid,Standard
4137743,305249001,Admission by obstetrician & gynecologist,Procedure,Observation,SNOMED,Valid,Standard
4137744,305257003,Admission by hematologist,Procedure,Observation,SNOMED,Valid,Standard
4137745,305259000,Admission by neuropathologist,Procedure,Observation,SNOMED,Valid,Standard
